,subreddit,body,created_utc
474,MensRights,"I've literally had that exact argument with white supremacists before.  One of them insisted that it wasn't racist to immediately throw all black applicants' resumes in the trash, because statistically, they're more likely to be criminals, and why would he want that for his business.

Never mind that background checks are a thing you can conduct on everybody (even a quick google search works most of the time), and that most black people are just *people* who want to live their lives without being saddled without all this completely unnecessary racist bullshit.

But nope, replace white supremacist with feminist and black people with men, and suddenly people think it's okay.

Also, I usually see people make this menkampf points to demonstrate when something is bigoted against men, but why aren't these so-called progressive feminists alarmed that a simple word substitution makes them sound like white supremacists?",1615976701
475,MensRights,"Wish they taught girls how not to be only fans where's, though.",1615976659
476,MensRights,"Well, she deserved it.",1615976591
477,MensRights,"There are probably just as many women doing it. I can say from personal experience alone that women tend to be more frequently violent (but men tend to do more damage on average due to their physical strength). 

Also, I think that provoking violence should be counted as a crime, a woman is not a victim in my book if she was intentionally provoking violence (which they often do from my experience).",1615976568
478,MensRights,The death penalty is barbaric.,1615976424
479,MensRights,"I remember when there was all this outrage on social media because SJW were saying its unfair to judge all Muslim people because the actions of a few.

And now it's actually the [law](https://www.express.co.uk/news/uk/1409084/Curfew-for-men-Will-UK-have-6pm-curfew-for-men-women-safety-evg) to target all men because of the actions of a few.",1615976420
480,MensRights,"&gt; dismantling the system of oppression

Can anybody who actually says this articulate what they mean?  I swear, if I ask ten people what it means to dismantle the patriarchy, I'll get twenty different answers.

This is one of the things that irks me about the gender studies rhetoric.  It comes across as a lot of vague navel-gazing better suited for a dissertation, not solving real-world problems.",1615976351
481,MensRights,What could possibly go wrong?,1615976196
482,MensRights,"&gt; E: I'd like to add the judge who gave Brock Turner The Rapist that sentence was a man who didn't want to ruin his life. The girl's life doesn't matter though

The problem is you see that as male privilege rather than attractive and rich privilege.  Men are more likely to be arrested, charged, and convicted for just about every crime.  Their sentences average 63% longer for the same crime and criminal record. That judge lost their job over that decision.

Do you go around commenting about this case of attractive and rich privilege?  No.  It doesn't fit your worldview.

https://archive.is/27gWl",1615976186
483,MensRights,"Modern women are allowed to wear a g-string and child-sized-bras in public, some are allowed to be shirtless. I don't care but  there are kids around and I don't appreciate kids being scared because women are walking around with their chest needles and camel toe because they claim that it is their right to be ped0s. If a man dressed like borat at the beach, he would get in trouble, but with good reason, women should also be held accountable for such indecency.

Mens-rights is great for the basic rights that are not being met but it shouldn't copy the mistakes of feminism, instead it should expose the injustices and limitations of feminism and how that hate-movement directly oppress men.",1615976102
484,MensRights,"But thats just because they like fetischizing and objectifying gay men, no hypocrisy there",1615975881
485,MensRights,Unless it's in an overpriced doujinshi,1615975580
486,MensRights,Main thing I've noticed about men's rights groups compared to feminist groups is how civil and just they are. We just want equality. Some of these feminist sub refits I've seen they are so malicious and horrible. I'm more worried about that group becoming serial killers tbh lol,1615975553
487,MensRights,11 inches is 27.94 cm,1615975447
488,MensRights,"The 1 out of 6 number comes from RAINN an organisation that does not recognise female on male rape.

Furthermore this is practically impossible as all types of crime have been decreasing furthermore the amount of reported rape cases total to about 100,000 , a massive decrease from the 1998 number of 150,000.

Therefore that would mean the chances of being raped in 2021 would 0.0009% , meaning the chances of the average man being a rapist is 1 out of every 1,600 men.",1615975445
489,MensRights,"The lengths that you stated are wrong then. You said 11 inches on average for shorts when your own source says that the shorter lengths are more common.

And for mini skirts it says 4 inches below the buttocks. Not that they're 4 inches altogether.

I get what you're saying though and agree completely. It definitely feels like men's clothing has stagnated and that's reflective of men's rights as a whole.

Listen, do not go down the road of judging women based on what women in them subs say. They are sexist opinions. Most women respect that we have preferences. I try to avoid them they only loss me off!",1615975434
490,MensRights,"Agree with everything you said dude, except that I think it's a bit late for ""preventing gender fascism"" -- it's already here.

That's the reason that women have noticed MGTOW, because it's not men talking, it's men *doing.*",1615975307
491,MensRights,Yeah but its all I found.,1615975242
492,MensRights,"So do you have to be completely blacked out before you consider it rape?
What about if a lady consented, then in the midst of the act, tells the man to stop, she doesn't want to continue and he doesn't stop. Would that be considered rape?
Or what about a husband and wife, where the wife says no and the husband threatens or yells at her until she says yes. Would you consider that rape?

Im asking to try and understand what you would consider rape.",1615975219
493,MensRights,"The problem with these people is that their tactic is not giving people equal rights, but instead they seek to bring down the other gender, and make them suffer as a result",1615975216
494,MensRights,I hope not but I wouldn't be surprised. It shows how backwards things have become that they can ridicule a whole group of people and get any with it.,1615975058
495,MensRights,"It wasn't ""if they could get away with it"".  It was ""if there eere no consequences at all"".  Plenty of men still wouldn't rape if they could get away with it, but the victim would be traumatized.",1615975049
496,MensRights,"To be fair, the title says that ""...it will lead to far more discriminatory privilage..."" 

So there is already, we just need more, it' not dicriminatory enough.",1615975037
497,MensRights,Murdered men don't live to tell the heartbreaking sexual assault story.,1615975008
498,MensRights,"I guess thats true to be honest , how many women have complained about the male homicide rate? About the injustice in family courts? And the other dozen male issues....",1615975001
499,MensRights,I laugh to keep from crying. Then cry anyway.,1615974785
500,MensRights,Kinda do but it only comes up if someone shows that they've been abused. The scars from scratches were brutal. Glad those fellas could make it out alive tho,1615989895
501,MensRights,That kind of case is very rare.,1615989890
502,MensRights,"If you think the statement 

&gt;Men lead, women follow. This is the natural way of things.

is part of reality, I have sad news for you- your worldview is seriously fucked up, and you need help. I don't think you're evil or heinous or anything like that, but that's a really degenerate, baseless philosophy.",1615989743
503,MensRights,"&gt; eventually say enough is enough

https://tvtropes.org/pmwiki/pmwiki.php/Main/ThenLetMeBeEvil

&gt; Sometimes the supposed ""forces of good"" in a story treat an ""evil"" character badly enough, for long enough, that the ""evil"" character just gives up trying to show the heroes that they are not evil and becomes a villain for real.",1615989700
504,MensRights,That is a very skewed vision of reality,1615989672
505,MensRights,"Well, #EqualWorkDay is just as accurate. They can place EqualPayDay in march if they want, but then they have to acknowledge that most of it is due to the women themselves. But feminists don't want to put any responsibility on women.

It would have been much better to place #EqualPayDay in january, and look into the other issues separately, because as we see, once we put everything together, it's impossible to even know what the issue is. People just end up thinking it's for the same job.

&amp;#x200B;

Now, just as you did, I could have told the other MRA's around here that the ""*equal pay act*"" doesn't mean the issue is fixed, but honestly, I don't want anymore. Feminists would which that we support them, but you get blocked everywhere, painted as hateful, violent, so why would I care? I couldn't help even if I tried.

The only place where you can support ""feminist goals"" honestly is on a MRA sub. I do it occasionally if someone brings up the issue like here [https://np.reddit.com/r/menkampf/comments/m0w51q/for\_every\_dollar\_a\_jew\_makes\_how\_much\_does\_an/gqbk5nd/?context=3](https://www.reddit.com/r/menkampf/comments/m0w51q/for_every_dollar_a_jew_makes_how_much_does_an/gqbk5nd/?context=3)

But other than that, I'll leave it to feminists to fix their shit.",1615989492
506,MensRights,I always fucking hate these things because they treat boys like they're future serial killers or rapists but girls are just pure.,1615989328
507,MensRights,"They just won't leave us alone will they, makes me wonder if Men are on their freaky minds every day and night, not an iota of sensitivity or civility, all blame no shame.",1615989095
508,MensRights,"Most murder victims are men. Therefore murder of men should be treated as an higher crime. Same with false allégations against men. Let's say that men should have a priority for mental health and drug services because most of suicide and over users of drugs are men. After all, it will make sense to do so.",1615988893
509,MensRights,"Typical feminist. Your only argument is ""you ugly, can't fuck"". Sad for your dad for being brainwashed. Making your own money maybe, but you will probably never let go of a chance to steal from men with all the laws in favor of women. 

Men are not the issue. Criminals are the danger for men. And therefore let's do the reverse of what feminists try to do. Exclude female victims of the talk and only doing things for male safety.",1615988716
510,MensRights,"&gt;They rode the Brock Turner thing for half a decade, but now they've found something else that they can point to and pin on men.

Brock Turner and Wayne Couzens are shitty human beings and should be regarded as such. I don't think most men are into raping women behind dumpsters and abducting and killing them, so we should remember that. Perhaps the better target should be national governments in Africa who tolerate FGM.",1615988678
511,MensRights,This entire down voted chain shouldn't have been down voted lol. For raising valid points.,1615988658
512,MensRights,"No, there is an above the books to stricten the entire working environment for everyone. Make everyone follow the letter of the rules. It's a very scorched earth policy though, as you would be burning good employees as well.

It's only a ""hostile work environment"" if she can prove she's targeted.",1615988462
513,MensRights,Yeah well club culture in general is terrible for everyone. Drugs and drinking will screw you up.,1615988437
514,MensRights,"Cat lady?

My name is tattooedWIFE. Lmaoooooo.",1615988394
515,MensRights,"This probably needs it's own post.

It's too bad the author didn't report the results for the question that was actually about rape.

I get that ""making a woman do something sexually that she didn't want to"" isn't much better.  But I could imagine survey respondents answering ""agree"" in the context of trying to convince a woman to say yes to a specific sex act.  For example, if it's oral sex, offering to also go down on her in exchange for her going down on you.

I mean they're probably 50 questions deep at that point so who knows what's going through their mind when if they answer ""strongly disagree"" for the question about rape, but then put down ""sightly agree"" to the question about sexual acts.

As the article points out, putting those two questions side by side implies that the researcher is asking something a little different than what the question seems to imply on the surface.",1615988331
516,MensRights,"Indeed. Self-esteem and an idea of one's self worth is always a good thing, however overblown self-esteem is a dangerous thing as it's breeds contempt for those you deem beneath you. If a girl has a list of demands as long as her arm, that no man can possible meet, because it's been drilled into her by the prevailing social view...then she will end up alone, childless and miserable.",1615988326
517,MensRights,"There was never any intention to actually pass a law that prevents men from going out after 6pm 

The woman that voiced it was doing it to point out the hypocrisy of people saying women shouldn’t go out late if they don’t feel safe.

Although I haven’t seen anyone actually say that. But acting like this law was seriously under consideration is embarrassing",1615988304
518,MensRights,Ok now this is exactly the problem.,1615988301
519,MensRights,"Ok that is probably one of the stupidest laws I've seen in a Western country. It almost feels like a sundown town, doesn't it? Men can be around at daytime, but will get driven out by force at night. Baroness Jones claims this will make men know how it feels for women...would the Baroness also be willing to live as a Black woman?",1615988243
520,MensRights,"Lol. I probably make triple your salary, because my dad's a feminist and have always been told to make my own money. Men are more likely to be killed by men, so you agree men are the problem and are the main threat to mens lives. Prize fool.  I imagine on the other side of your sweaty, grubby, crumbed keyboard there sits a bitter and twisted man,  because even with your ""great personality"", no woman wants to fuck you. Would you like me to send you a drinks voucher, so you can sit and wallow in your little pity party, feeling ignored and sorry for yourself?",1615988210
521,MensRights,"The stat isn't faulty. The stat is accurate. The justification is what can be faulty. 

Saying its entjrely due to discrimination is blatantly incorrect. 

That said, I think saying 'women choose lower paying jobs and take more time off so who cares' is also faulty. 

Why do women have lower paying jobs and why do they take more time off? 

Assuming genders are equal, its weird that so many women are missing so much more work and doing so much less overtime. So drilling into that shoukd be the goal of feminists. 

Not painting it as discrimination alone. Thats flawed logic.",1615988204
522,MensRights,"No.

How many men do you know that dated girls under 18 when they were 18+?

They should have been held accountable for that and the majority *never* are. *This is the point I'm trying to make. Hold men accountable.*",1615988070
523,MensRights,"Men certainly have a sense of caution around women but it is a really weaker instinct than the reverse for women since the biological cost of a misjudgment is so much bigger for women (without modern inventions, that is). 

Honestly, men are better served by tapping into this instinct nowadays because we've flipped over all the risks and potential costs to men with the help of technology as well as laws. Think about it- women have multiple unilateral birth control methods and even if they choose not to use any of them they are not burdened by parenthood. Men, on the other hand, have access to one reliable but non unilateral birth control method- condoms. The only other option for them is to get a vasectomy. And with that, they can be burdened with parenthood based on the choices of anyone who gets access to their sperm. They can literally get raped into parenthood. How the hell do men muster the courage to even talk to a woman baffles me sometimes.",1615988024
524,MensRights,"Domestic abuse/sexism is common in Spain, most often victims being women, so yes it makes sense for Spain to do that.",1615987994
525,MensRights,I bet feminist teachers are salivating over the possible of government permission to practice misandry. It's literally government sanction to mentally abuse male students for a paycheck.,1615987986
526,MensRights,"I am also arguing that the wife in this case, deserves a share in the combined income by right. As the wife's effort in child rearing and cutting down on work hours helped the husband focus on his career despite being a father (wife performed indirect financial contribution). So akin to how investors collect profit, a certain share in husbands money belongs to the wife.",1615987977
527,MensRights,"Yet more "" All men are trash"" feminist claptrap. The thing is, the more they try and drill this in (especially to teenage boys) the more they will rebel against the ""programming"". It's what kids do. I have a teenage son, and he and most of his friends have no desire to be around girls because in his own words "" they are insufferable to be around, are entitled, demean the boys at every opportunity and are supported by the teachers in this view"".

We are breeding a generation of boys who will disengage with society and women in particular all because we have let the feminist agenda run riot and tell them they are worthless EXCEPT as a means to support women's ambitions.",1615987831
528,MensRights,Kafka trap mate. I don't know if you've heard of that statement but Google it. Nice lady just told me about that and I'm so glad she did.,1615987787
529,MensRights,"You have to define rape as well, feminsit would say looking at a womans boobs is rape.",1615987739
530,MensRights,"I have seen women beign victim blamed, usually in rape cases. Do you want to know a fun fact? It's not only men that victim blame. I have seen a lot of women doing the exact same thing, saying the usual words:""she sould have dressed more conservatively"" and all the other iteractions. It's not ""more men or more women"" that victim blame. It's shitty people that victim blame. In no way, shape or form victim blaming is peculiar to one gender.",1615987715
531,MensRights,I'm trying. What compensation do you think is appropriate?,1615987514
532,MensRights,"I've thought about this bud, but, I love love lol.",1615987453
533,MensRights,Ocasio-Cortez is always good for a laugh; we've yet to see if she's ever going to be good for anything else.,1615987421
534,MensRights,And you only have two comments and no posts for a year account yeah right,1615987356
535,MensRights,Obviously she was being so kind that she chose to only injure him instead of killing him,1615987351
536,MensRights,"https://archive.fo/yW7m7

They're not even trying to be honest anymore.",1615987277
537,MensRights,"😆 It's okay, you can admit you're a lightweight.",1615987257
538,MensRights,Yeah I don't use reddit because it is full of toxic folks who would not believe things that don't serve their narrative. I came to comment since my picture is up there.,1615987227
539,MensRights,https://archive.fo/X28VE,1615987186
540,MensRights,MGTOW,1615987164
541,MensRights,"Exactly mate. The same rules apply to men, and I think why we've become up in arms as well is because we're also so much more highly likely to be murdered in these situations. We know this. It's inherent for our survival you could say. They're does need to be better policing, sentences actually taking action on ALL crimes. The world from its inception has always been violent, you an I know this 🌋 maybe some people don't live in the real world, aren't streetwise maybe, not excusing anything here. There's this victim blaming mentality about women being raped as well....it's erm...😕",1615987058
542,MensRights,"Lot to unpack here.

Fathers are legally obligated to take care of their wives and children too.

I never said women shouldn't perform house work. 

If a husband already gave a huge amount of money to wife before divorce it can be deducted from alimony

You are context dropping while using the difficulties of poor lower caste women as an argument. You quoting poor lower caste women is like feminists saying LOOK LOOK AT THE WOMAN WHOSE RECTUM WAS PIERCED OUT DURING RAPE AND THEIR FACES GET ACID ATTACKED! HoW DARE YOU FEEL SYMPATHY FOR MEN! While you argue for mens rights. And imagine a feminist repeatedly bringing up that argument when you talk of men's issues. And saying DON'T YOU CARE ABOUT RAPED AND TORTURED WOMEN! when you talk about discrimination men face. I think we can both agree that you thoroughly feel bad for women who get raped and I feel very bad for the hardships that poor women go through. To imply that because I am arguing for alimony, I somehow donot care about poor women, is extremely disingenuous and an argument made in bad faith.


Err...i never said fathers aren't important. I actually made an argument FOR 2 parent families in my comments. Saying mothers/primary care givers are important doesn't mean fathers are unnecessary or bad/not wonderful.

After a divorce, a woman no longer lives in the same house as the husband. Also, like you said, house rent is compensated through house work. We are talking about support that must extend after a divorce to a wife who chose/continues to choose to focus on raising children instead of on a career.",1615987050
543,MensRights,"Yes. But it would be far easier to have that discussion if feminists didn't use faulty stats as always when they define #EqualPayDay.

If they had put #EqualPayDay mid-to-end of january, I would have taken them seriously, but these liars placed in in march.

I can play the game of faulty stats too: let's talk about #EqualWorkDay. Only difference: I admit these are faulty stats and don't try to mislead anyone.",1615987008
544,MensRights,"Yeah, can't imagine you can afford champagne. Honey, it's on me.",1615986957
545,MensRights,"&gt;1 in 3 (30-35%) of men would rape if they knew they’d get away with it. 

That statistic is incredibly misleading.

It really states that 1 in 3 college men would have sex with a random women with no strings attached if they could.",1615986842
546,MensRights,Wow. That's terrible. So sorry you're being dismissed and gaslit in this way.,1615986812
547,MensRights,Exactly,1615986708
548,MensRights,"I've never heard an answer put so well, thank you for this. Kafka trap, I didn't even know what one was but so grateful that I now do. I think so many people easily fall into these traps of entertaining nonsense, only further prolonging the nonsense, especially nowadays. 

Just to note on the flip side I think there's a fear from men that women will break their hearts, manipulate them, cheat on them, take advantage of them, leave them when they're no longer of use, which inevitably prolongs this fearful state leading them not wanting to get involved. I think the majority of both sexes overall suffer quite a bit because of these fears, ideologies and even dogma in some cases of what the other potential partner could possibly do, even though statistically the odds of this are proven to be pretty low? It's like the femme fatale thing for men....double edged sword. 

There's this fear on both sides of not wanting to get our hearts broken and potential grave danger. It's kind of like our anxiety systems to warn us of saber tooth tigers &amp; cavemen strangers, they were good back in the day but they aren't really serving us now. This leads to men not approaching and women feeling unapproachable? 😣 I'd love to know your thoughts on this",1615986680
549,MensRights,"http://webshare.law.ucla.edu/Faculty/bibs/stemple/Stemple-SexualVictimizationPerpetratedFinal.pdf

https://www.scientificamerican.com/article/sexual-victimization-by-women-is-more-common-than-previously-known/

/r/MensRights/comments/koinom/some_sources_on_the_sexual_abuse_of_men_and_boys/

/r/MensRights/comments/f5tes5/gender_parity_for_sexual_assault_academic_studies/

Another interesting fact is that most men who rape women were themselves sexually abused as boys by older women.

I don't have that link super handy right now but the UK empathy gap website has an article there about it.

http://empathygap.uk/",1615986410
550,MensRights,Yes you were or you wouldn't have asked why someone didn't defend themselves. You never ask about what the victim should have done.,1615986398
551,MensRights,"I prefer bourbon, neat. Lol",1615986337
552,MensRights,"No sir im not, i was just curious to why? Now i understand, men in the west are being treated unfairly by the justice system.",1615986327
553,MensRights,"Damn, how dare I post pictures of myself in the nip with the hopes of making an income out of it. Fuck you lol. 

So you're saying if I was nicer these things wouldn't happen? Because they very much do. But sure, I only post those pictures because i want to be treated like a sex object in my personal life. What a fucking genius you are.",1615986222
