,subreddit,body,created_utc
984,MensRights,"That is exactly point of feminism. You have an idea that

1) feminist is a woman. Absolutely not true (e.g. the psychologist Honza Vojtko)

2) a woman driven by emotions
It makes us feel degraded to just nonrational beings who aren't capable of rational arguing.

And to point out some inequality in Czechia
- the recent affair when Blatný refused to allow Polish women to get an aborting in CZ, changed is view only after the public started complaining
- there is much less women in politics (22,5 % in parliament in 2019). Definitely not the 50:50 that we should aim for.
- Radim Uzel and his influence (""Touching women's ass is okay, helps with relationships in the working space."" ""Rape has always been here and always will."" Stereotypes like ""Men are aggressive, women should beware them."") His interview on DVTV is absolutely terrifying.
- doctors not allowing women to get sterilezed as ""They may change their mind"" (was discussed in the group I describe lower)
- body shaming, slut shaming, virgin shaming
- stereotypes of any kind

If you want to see my and Czech feminists perspective (not radical, no KMA here), you can check (pun not intended) out the group Everyday Patriarchy Bullshit on facebook. It should be public, joining isn't mandatory to see the posts. As the name suggests, it mainly shows everyday little things that are against equality. For non-czechs, let me describe some of the  recent posts

- *picture of dirty hands, from repairing a car or something* and the text ""If your man's hand never look like this, you're dating a girl."" (Notice: the point of posting this to this group is to mock the picture, so it's point is to ""fight"" against the stereotype ""men should be dirty, else they are not manly enough"")
- *picture of some coach in gym, women who bend themselves such that their genitals are exposed, he touches them ""to help""* and again joking text ""I'd looooove to have this job""
- pictures from language textbook promoting stereotypes
- the pic that was also popular on Reddit with Google translate assuming genders for neutral pronouns
- a discussion about the information that 90% of male r*pe is caused by another man (the OP is asking for resources for this. Resource-searching is kinda often in there)

This is where my journey of a feminist began, so that's why I'm recommending this to you. The group is very welcoming and supports debate, so if you want to pose some question there, it shouldn't be a problem. 

Personally, I believe that in Czechia, women aren't opressed systematically or something. There is a lot of sexism coming from older generation (e.g. our professor telling us that women should not study *my specialization*), but we're doing pretty okay.
Countries like India, Poland, Sudan and many more African/Asian countries need feminism desparately more.


Also, you haven't insulted me, it's ok. Maybe we well meet again in a discussion at EPB.",1616884059
985,MensRights,"Lol well they may not think feminism is what it actually is. You guys taught me that, but I have a pretty tough skin, so I looked past being called a feminazi bitch/whore/cunt and saw the info you gave, and I decided that I'm not a feminist. But many wouldn't stick around after being bullied like that. That's my point.",1616884041
986,MensRights,"Considering I wouldn’t let mine back in the house after committing domestic violence, I filed with CPS, filed a protection order, and filed for stalking before she decided to make the accusation, I’m hoping they see it as retaliation on her end.",1616884028
987,MensRights,"This place has always been a laughing stock, in 2007 they had a ""two brick rule"" that students of opposite genders couldn't come within two bricklengths of each other. Why they used bricks as units is beyond me.",1616883898
988,MensRights,"There arent shitty genders just shitty people. Horrible people permeate race, gender, politics, religion",1616883869
989,MensRights,"It means solipsism. The bias some individuals have in which they think other people have to be exactly like them. But I don't think solipsism is the right word as it means something really different.

Anthropomorphism is a human bias in which we're likely to assume human characteristics, feelings, thoughts, intents, personalities, incentives, or physical shape, to animals or aliens. Gynomorphism is the adaptation of that word to describe women or people who tend to think men are like women.

I'm ESL tho so take this with a grain of salt.",1616883807
990,MensRights,You realise the United Nations is an absolutely massive political organisation right? When there is sexism against men (and that's what it is when you share tweets like they did on international men's day) coming from that level then there's very little anyone here can do besides call it out. I know that I and many others did on their account but most guys know right now that men's issues are not considered as important as women's and that men are considered more disposable in the western world (why we will always hear far more about supposed gender pay gaps than male suicide or homelessness rates for example..or just that they could have the gall to make that tweet on the one day meant for men). I think more and men will get angry and point things out but it will take time for anyone to take it seriously such is the level of mainstream misandry. Tbh it will come full circle eventually and feminists are acting as their own worst enemies..but again..for now men will continue to be sh*t upon.,1616883795
991,MensRights,Not sure as it was some years ago when I had to deal with family court..had a PA lawyer explain to me and wasn't really listening but do remember 66% and that the more I payed the more they got back in enforcement fees,1616883775
992,MensRights,"&gt; The situation resulted in us putting hands on one another but she eventually left.

&gt; it just so happens that I had went on a date and slept with a girl that I actually really, really liked that same night, but hours before the fact.

I’m not this kind of guy, but, if I was, I don’t think I’d tell my wife that I’m this sort of guy, and, if I did, I’d realize that she doesn’t seem to believe the story of my ex more than the story I told her...",1616883710
993,MensRights,DUDE. Thank you SO much. This is exactly what I need! Really appreciate it c:,1616883573
994,MensRights,As a greek i can agree to that 100%,1616883522
995,MensRights,"Both forms of prejudice, so yes, they’re quite clearly connected in that respect, plus I never even said they weren’t. They can overlap sure, but they’re two completely different problems. Do you think they’re equally important issues?",1616883492
996,MensRights,Please look for the book Lovism: A Humanist Alternative to Feminism. It describes what you are looking for.,1616883488
997,MensRights,Thank you.  Fixed.,1616883414
998,MensRights,"I can definitely see this. Most of my friends are guys and it’s a lot more challenging for them to open up. My boyfriend took quite a while, when he cries I hold him tight like an actually supportive SO. So I suppose many women see it from your GFs perspective, because he was suprised. It still really sucks that you have to bottle it up. And her response was pretty fucked IMO. 

It also really makes it a lot harder to actually seek help if there’s something going on. 

Actually, a couple hours I talked to one of my best friends because he seemed “closed off”/resistant to emotional vulnerability. He opened up finally, almost in tears, telling me all that’s going on in his life. In that instant I watched the detrimental effects of the “real men don’t cry” bullshit unfold. 

Do you think that men’s mental health is often overlooked because of this? I thought my friend was just feeling “weird/off” and I had no idea he was really depressed. Also, everyone I’ve ever personally known who has committed suicide is male. I don’t think that’s a coincidence.",1616883403
999,MensRights,"Ok, so it's a reimbursement at a much higher percentage then I thought. 

Do you know where I can find that amount?",1616883397
1000,MensRights,"Men are not equal. Some are leaders and some follow, some even fail to launch entirely. Call it what you like. Whatever we associate with the types of men. Will all sound the same when we get used to it.

Whatever you want to call a wooden sitting implement. It will sound like chair to you regardless",1616899995
1001,MensRights,Because she changed sides when it suited her.,1616899995
1002,MensRights,Golden opportunity for anyone here to make a TwitterMen to share posts and news from our community for potential support and awareness since the tag apparently isn't taken yet.,1616899939
1003,MensRights,"I find it interesting that the ERA is starting to take another run at getting passed.  If the ERA passes, I can see it benefiting men more than women in those situations where the needle passed ""equal"" long ago.

For example, women would be forced to register for the draft.

I suspect when the ERA was first attempted, it was all about giving women equal opportunity (at least that was the intent).  When/If it passes this time, it will be about not discriminating against men :-).",1616899939
1004,MensRights,"It’s not so much being against feminism in its ideal...which is equality...as it is being against misandry which has always been lurking in the background. Old ant-feminists saw this. The next generation got fooled. The goal of radical feminism, which is now just called feminism, has always been to eradicate some imagined wrong and create a world where men are second class citizens. No one is fighting for equality anymore. They’re fighting for superiority now that they have equality. Of course, they argue that equality hasn’t been achieved so they can keep fighting. But, what they’re fighting for now is domination.",1616899767
1005,MensRights,what kinda question is this? Its like showing up to a funeral and asking why everyone is sad. Take a clue bro,1616899723
1006,MensRights,"Can't expect much from a country without a written constitution who's appalling behavior inspired half the world to write one, with a declaration of independence attached.

The UK had my respect until brexit gave them the media coverage I needed to open the window into Britain. I'm glad the problem sickman of Europe can go on a soul searching vacation for a few decades.

Dont waste a good crisis guys. Or your enemies will take their chances. And you'll be home at 6pm every day.",1616899715
1007,MensRights,Soon they will be deplatformed and cancelled just cuz of the acronym.,1616899631
1008,MensRights,Feminist hate\*,1616899528
1009,MensRights,Doesnt matter bro... they deserve getting hated it on every subbreddit like wtf is this feminist bullshit on FDS and 2xchromo,1616899509
1010,MensRights,"That ops bio explains everything lmfaooo. Shes an edgy ""depressed"" teen girl probably",1616899393
1011,MensRights,"No they make shallow lip service claims.

They use word salad and platitudes, it would be more honest if they just didn't respond.",1616899282
1012,MensRights,"Whatever your feelings on it, I think this kind of near-ubiquitous experience is why MGTOW has become a thing. Way too much of the dating scene prioritizes feelings over reality.",1616899249
1013,MensRights,"I'm not against feminism, since the word has very little meaning anymore.  Give me a specific issue, and we can discuss.  If women are favored over men for jobs (for example) or men favored over women, I would argue it is discriminatory and should not happen.  Actually, it is against the law, but hard to prove in court.",1616899030
1014,MensRights,"100%.
Both are quite damaging.
Wouldnt want to be called a rapist for the rest of my life for a crime i didnt even do.
Rapists are terrible but so are false accusers",1616898539
1015,MensRights,"Worst part is that they claim to be feminist but shit on men.
Give me a dollar for everytime ive seen that",1616898418
1016,MensRights,"Just imagine his friends. They'd all introduce him as 'that cuck with the crazy feminist wife,' behind his back.",1616898285
1017,MensRights,This is such a non-issue.,1616898121
1018,MensRights,Anyone who thought this was a good idea should be immediately fired. We do not need sexist POSs working with our children,1616898035
1019,MensRights,It’s called insecurity and projection. We’re examining a very lost woman.,1616898014
1020,MensRights,That is incredibly weird.,1616897952
1021,MensRights,"So basically you admit you don’t have sympathy.

Yes, you are blaming men. You’re response to men getting attacked more is that men are the ones doing the attacking. That’s precisely an example of what victim blaming is.",1616897947
1022,MensRights,"Corona is killing two to three times as many men than women but all we're hearing about is ""women hardest hit"".",1616897942
1023,MensRights,I hope that parents of both boys and girls are losing their minds over this dehumanization. I would own that school by the time I was done with them if this happened to my son.,1616897923
1024,MensRights,"Not wanting to engage in a debate is perfectly fine, but coming into a men's rights subreddit and making a comment saying, ""Women have it worse,"" without elaboration is the kind of thing that invites debate. If you're going to express your beliefs in a space that generally disagrees with those beliefs then you should expect people to challenge you. I thought that by making your comment you were opening the door to a discussion.


&gt;My only intention by saying nah you're just gonna get off on it it was to say just that. Us going back and forth, jabbing each other with hyperlinks of data until who's right on who has it worse isn't going to prove or change a damn thing.



This is reasonable, but you expressed it a rude way. Saying that you'd rather not get into an endless back-and-forth is something that I would have respected and agreed with, being dismissive and making veiled allusions to masturbation is unnecessary. However, I do appreciate you clarifying what you meant.

If you'd like to simply agree to disagree then I'm fine with that.


&gt;And if I wanted to insult you I would have called you an unseasoned chicken breast. But I don't. And you aren't one.

Thank you for not calling me an unseasoned chicken breast. I don't think you are an unseasoned chicken breast either.",1616897695
1025,MensRights,When feminists have been given the opportunity to run services they have always excluded boys and men.,1616897681
1026,MensRights,"Oh I didn’t see that, now I understand, Twitter themselves makes a account for the women there but doesn’t for men.",1616897678
1027,MensRights,"Sorry me saying that the data (or rather the outcomes of sa and dv) are gendered wasn't invalidating that men experience rape. Sexual violence is violence regardless of gender. Violence Prevention is my jam though, and interventions and policies need to be targeted, therapeutic, and relational. I'm willing to bet if I was an interventionist and I got a grant to run such a program in a random city in North America, a majority of my population coming for services (most likely those court ordered after a guilty plea to a SA charge) would be male identified. Thats just the reality.",1616897675
1028,MensRights,I don’t think an author like that is capable of loving a real human. She got married because she’s aroused by him and wanted to check a box on her life list. Just more proof of white female privilege.,1616897625
1029,MensRights,This news isn't in the mainstream media yet. And I don't think it will ever be.,1616897607
1030,MensRights,"I’ve heard men make jokes about *men and boys* being raped. Prison rape jokes, catholic priest rape jokes, schoolteacher rape jokes. I don’t recall a single time in my life when I heard a man make a joke about *women* being raped, however.",1616897529
1031,MensRights,Her understanding of reality seems precisely tailored to paint woman as the victims and white men as the scooby doo villains. The thought of men having it worse than woman angers her to a point of rage. But what do I know? I’m just a basement dwelling rapist who needs to be taught that rape is big bad.,1616897350
1032,MensRights,"HEY GUYS TODAY FOR TIKTOK WE’RE GONNA SEXUALLY ASSAULT A MALE BECAUSE IF YOU HAVE IT FLOPPY BETWEEN YOUR LEGS YOU CAN’T BE RAPED, THAT MAKES SENSE.

*gets 7272828383828383 likes*
*gets a nobel peace prize*

Someone: That’s sexual assault!
*Their phone 5 seconds later*.        
ANGRY MOB WANTS TO KNOW YOUR LOCATION",1616897270
1033,MensRights,"Tulsi Gabbard.

I have never seen a candidate that has gotten support from Democrats AND Republicans.",1616897010
1034,MensRights,FDS is modern feminism without the filter.,1616896907
1035,MensRights,"Wow, what a pleasant and reasonable article!",1616896713
1036,MensRights,"DV -

I suggest you read the Overview section of Erin Pizzey's wikipedia page or one of her books.  She was the founder of Refuge, one of the two organizations in the UK that recently had their funding diverted to nondiscriminatory organizations after decades of sexism.

https://en.wikipedia.org/wiki/Erin_Pizzey

She created the worlds first domestic violence shelters.  After opening several for women in the UK, she suggested that men could be abused too and men needed a shelter too.  She was then slandered, her kids were threatened, her dog was killed, bricks were thrown through her windows, and she was removed from the DV organization she founded (now known as Refuge which has now lost funding decades later).  She fled the country for her childrens safety and became an outspoken DV activist and anti-feminist once they moved out on their own.




I wish we as a society look at gender neutral domestic violence data instead of studies looking for violence against women.

&gt; Almost 24% of all relationships had some violence, and half (49.7%) of those were reciprocally violent. In nonreciprocally violent relationships, women were the perpetrators in more than 70% of the cases.

Src: http://www.ncbi.nlm.nih.gov/pmc/articles/PMC1854883/

Behind a paywall I have archived around, but Harvard research that women are more likely than men in starting or escalating domestic violence and those women are by far the women most likely to be injured in DV. That doesn't say all women injured are perpetrators themselves, but it does indicate the problem goes beyond the feminist/pop culture model of ""violence against women"".

It includes:

&gt; Almost 25% of the people surveyed — 28% of women and 19% of men — said there was some violence in their relationship. Women admitted perpetrating more violence (25% versus 11%) as well as being victimized more by violence (19% versus 16%) than men did. According to both men and women, 50% of this violence was reciprocal, that is, involved both parties, and in those cases the woman was more likely to have been the first to strike.

Src: https://www.health.harvard.edu/newsletter_article/In_Brief_Domestic_violence_Not_always_one_sided

or

http://archive.is/7vuUz


This is a long meta study that shows we've known domestic violence isn't gendered for decades.

https://connect.springerpub.com/content/sgrpa/1/3/332
or the whole study here
http://www.menweb.org/battered/StrausV78.pdf


Popculture article - 

https://thedailycounter.com/male-victims-of-domestic-violence-are-they-ignored/

Most domestic violence research today is research of ""violence against women"" from grants specifically looking for data on violence against women, not gender neutral research.

oncefa2 has posted lots stuff on this topic with academic references.  I think the best two for references are...

https://old.reddit.com/r/LeftWingMaleAdvocates/comments/f604hw/some_sources_on_the_severity_of_domestic_violence/

and

This one is interesting because usually as soon as I point out that DV isn't gendered someone explains it is because more women are killed by their partners than men.  It wasn't always that way.  Women got better options and stopped killing as much.

https://old.reddit.com/r/MensRights/comments/e6hxvq/battered_husband_syndrome_as_an_explanation_for/

If the goal is to save women's lives rather than demonize men, it sure looks like we should be giving men better looking easily available options.  But the folks that run DV programs don't want that.

I also suggest you look into the feminist Duluth Model of Domestic Violence Intervention which results in men being beaten by their wives being arrested more often than the perpetrator when they call the police for help.

Ellen Pence (The creator) herself has written,

&gt; ""By determining that the need or desire for power was the motivating force behind battering, we created a conceptual framework that, in fact, did not fit the lived experience of many of the men and women we were working with. The DAIP staff [...] remained undaunted by the difference in our theory and the actual experiences of those we were working with [...] It was the cases themselves that created the chink in each of our theoretical suits of armor. Speaking for myself, I found that many of the men I interviewed did not seem to articulate a desire for power over their partner. Although I relentlessly took every opportunity to point out to men in the groups that they were so motivated and merely in denial, the fact that few men ever articulated such a desire went unnoticed by me and many of my coworkers. Eventually, we realized that we were finding what we had already predetermined to find.""",1616896671
1037,MensRights,"Is getting off on something really an insult? Is it? Is someone saying they don't want to explain their point of view because they made a comment about the role of women throughout history and the perception of women and effects of said perception which has caused the destruction of countless lives is worse than the ramifications patriarchal ideals had on themselves.. Really an insult to you? 

My only intention by saying nah you're just gonna get off on it it was to say just that. Us going back and forth, jabbing each other with hyperlinks of data until who's right on who has it worse isn't going to *prove or change a damn thing.* 

And if I really thought petty insults were a valid form of argument, then I wouldn't have had the decency to say no human being deserves cruelty and I wish we could all just be loving and merciful to each other. And if I wanted to insult you I would have called you an unseasoned chicken breast. But I don't. And you aren't one.",1616896630
1038,MensRights,"My ONLY advice is if you get out of this:
1. Never co-habitate with a woman
2. Never get married.
3. Don't have kids.

Many men repeat the same mistake thinking they'll find someone better. Remember, there are no Unicorns.",1616896556
1039,MensRights,"I think the first one is ok but the second is just dumb, if I'm gonna get a better deal/product from a straight white male owned business than I would from any other business I'm obviously gonna pick the one owned by the straight white male.",1616896473
1040,MensRights,Why are you getting downvoted? I thought the entire point about equality is realizing that we all need to treat each other like people and not demonize or objectify others?,1616896307
1041,MensRights,"I don’t trust anyone with the “only God can judge me” tattoo. To me it means “I know what I’m doing is wrong, but I’m a piece of shit and I’m still gonna do it anyway.”",1616896217
1042,MensRights,"I disagree, but I’m old fashioned.",1616895409
1043,MensRights,"So you're unwilling to even consider having a reasonable debate, and think that petty insults are a valid substitute for legitimate argumentation? This does nothing but reinforce negative Feminist stereotypes, which is exactly what the OP is about.",1616895316
1044,MensRights,"It’s a general contractor, not a rights org",1616895212
1045,MensRights,"&gt; Women are fucking horrible to one another, but not openly or in public. 

*Behind the back* of whoever they're talking shit about, in public or not. As long as that person isn't physically present, they'll do it openly as hell. Virtually too, they'll just cut that person out of the group chat to do it.",1616895201
1046,MensRights,There was post there today with the title “men should be bodyshamed more”.,1616894818
1047,MensRights,"Nah, I don't think you're even worth the time. I think you'd get off on it",1616894715
1048,MensRights,You believe the gendered natured of sexual assault and dv data is due to manipulation?,1616894358
1049,MensRights,"I remember back in 2014 when the Wikipedia edit wars on GamerGate went on. It was:

1.) Gamers criticize gaming journalists on Twitter/reddit.

2.) Gaming journalist feminists write inflammatory articles about gamers in response.

3.) Feminists edit the Wikipedia article on GG citing the things they wrote in those articles.

4.) The Wikipedia turns into a dumpster fire that unironically starts with ""The Gamergate controversy concerned an online harassment campaign...""

5.) Since there are secondary sources calling GG an online harassment campaign of incels, Wikipedia sides with them in the end.

It would be like a scandal occurring within a company, and despite the mountains of evidence proving wrongdoing, the company making a statement blaming consumers for attitude, followed by the company's statement being the only thing reported. 

I barely visit Wikipedia anymore. Whenever they beg for donations I just laugh. Adblock on, never donate, etc.",1616894323
