,subreddit,body,created_utc
0,MensRights,"&gt;&gt;Spinning Men's Issues as Misogyny
&gt;
&gt;Otherwise known as trickle down equality.

Sincerely, do you think it is possible for men and women to work together cooperatively on issues like this? How would you prefer women allies to approach these topics? I'm afraid I've come across like this while trying to demonstrate commonality.

An example might be a men's group advocating against risky/dangerous work bias, while a women's group advocates against infantilisation bias. Can they be allies? What would help?",1615948744
1,MensRights,Bruh wtfhttps://archive.org/details/FalseRapeAllegations,1615948738
2,MensRights,"i assure you that women don’t consider looking in our general direction sexual harassment.

i’m sorry that that happened to you but i don’t understand how that justifies you saying that we are bragging when we share our stories. because most of us feel embarrassed that something like that happened to us. and isn’t that just a little bit fucked up.",1615948625
3,MensRights,"Hello there! First of all, I appreciate you asking questions instead of attacking me right off the bat. Second of all, I've had a very long day so I'll do my best to be thorough right now but please forgive me if I make a mistake or misunderstand your questions. 

1) When I say I am a feminist, I mean that I stand behind fighting for womens rights around the world. Especially those who can not speak out for themselves; not necessarily just the injustices we see here in the US. I **do not** stand behind any organizations that put female interests *ahead* of men's rights and that is never my intention so if I unintentionally say something that aligns with those views, please correct me and I will apologize. Like I said in my original post, I don't just call for equal rights when it is convenient. I truly want *equal* rights. 

2) The two women's issues that hold a special place in my personal life are reproductive rights (already progressed a lot here in the US this last decade or so but still a ways to go) and workplace discrimination. Around the world women and girls face challenges such as freedom to travel independently, freedom to dress as they want, the right to vote, freedom to choose their spouse, and forced genital mutilation amongst many many more.

3) Honestly I really know nothing about her so I can't say much. 

4) Of course! I love hearing statistics! It's probably one of the best ways to get a truly objective understanding on a specific topic (as long as it's from a creditable source)",1615948526
4,MensRights,"That's fucked, I'm not sure how to even respond to that",1615948403
5,MensRights,"People who demand support but give less than nothing in return have no right to be upset, lol",1615948273
6,MensRights,"There are studies proving that women enjoy the sight of men suffering. So I think part of female nature is sadism. They couldn't act out that sadism in the past but now they can and do.

[https://www.theatlantic.com/health/archive/2012/04/study-of-the-day-women-are-much-happier-when-men-feel-their-pain/254204/](https://www.theatlantic.com/health/archive/2012/04/study-of-the-day-women-are-much-happier-when-men-feel-their-pain/254204/)",1615947948
7,MensRights,"Oh the first 2 letters OBVIOUSLY mean Male Racist A (MRA)  
/s",1615947948
8,MensRights,"And they won't accept an article quoting only the Daily Mail, because the Mail is deemed to be so untrustworthy.",1615947903
9,MensRights,[removed],1615947883
10,MensRights,"It is [missing white woman syndrome](https://en.m.wikipedia.org/wiki/Missing_white_woman_syndrome)

Just point out that it happens to minority women just as often but no-one gives a shit about those women. It's good for dividing feminists and getting them to nag each other.

Then point out that the wife of the man who did it was arrested as well for trying to help him. Ask them ""I wonder if the poor girl might have survived if his wife did the decent thing?""

Finally point out that feminists have been so toxic, hijacking a rare tragedy to push their hateful rhetoric that her friend [took time away from grieving her death to tell the world that Sarah would not have liked what they've done](https://www.spiked-online.com/2021/03/13/this-is-not-what-sarah-would-have-wanted/)",1615947846
11,MensRights,"If a woman murdered a woman,   cant lock down all men",1615947842
12,MensRights,"I disagree. We have many insanely qualified minority workers of all ages. Many are women as well who totally kick ass. However, it’s the DEMAND to send a particular age/race/sex that pisses me off.",1615947662
13,MensRights,"You are right, I should have phrased it more clearly. I included the simps / manginas / male feminists in the ""feminists"" part. Maybe it is not clear enough.",1615947582
14,MensRights,"We have women apply, they just don’t go for sys admin roles. We have lots of female data scientists. They are great! Even some badass female devs. However, for this role, in this org, no women want the job.",1615947459
15,MensRights,"&gt; HOLY SHIT. WHY DIDN’T I THINK OF THAT BEFORE?!? In fact, why didn’t the millions of incels in world realize this? Tell me, since you’re an expert on this topic, should I “take a shower” as well? 

Honestly yeah, a shower wouldn't hurt. 

&gt; My point is that men with high paying, stable jobs, tons of investment assets and no debt are still facing a WAY more difficult dating market than an even an average, plain, boring woman. 

That's because any woman can raise their hand in a crowded bar, yell ""who wants to go home with me"" and probably 5 guys at least will raise their hands back at her, most likely more if she's attractive. Men typically have to work harder to get laid yea. So what? You see throughout the animal kingdom that the males are usually the colorful animals that have to do the mating dance to attract the female. I don't hear them bitching. It is what it is man, this whole sexual marketplace power imbalance isn't unique to humans. You're either gonna have to get over it and adapt to it or get used to living a sexless life. 

&gt; If you’re going to argue in bad faith, then it is literally a waste of my time to talk to you. And if you aren’t willing to believe the things I say about MY OWN LIFE, then you are wasting your own time talking to me. Going back and forth saying “You’re a misogynist!” “No I’m not!” “Yes you are!” Is going to get us nowhere. 

I wasn't arguing, just pointing out that the points being made were from a place of bitterness and did not at all contribute to the men's rights movement. If you want to trivialize the movement and make it all about how some incels are sad they aren't getting action, then we will never in a million years be taken seriously by anyone.

&amp;#x200B;

&gt; Come on dude: Fix society, work on self improvement. If you want specifics that’s another discussion entirely but I’d be more than happy to give you a quick rundown. 

Actually yes I'm curious about specific solutions other than the ones we agree on ie. better yourself and whatnot, because I'm unsure that there are actually any realistic solutions that don't involve changing society as we know it. It will always be easier to change what you don't like about yourself than to change society. So if you don't like the fact that you're not getting laid, can we at least agree that it would be easier to add to your sexual marketplace value than to change the entire sexual marketplace as a whole?

&amp;#x200B;

&gt; No. That’s like saying “Oh you don’t like being in prison? Why don’t you just start your own jail so you can be the one enslaving others instead of them enslaving you?” 

Not at all actually. I fail to see the parallel line drawn between our discussion and this example. 

&amp;#x200B;

&gt; That’s idiotic if you think about it for more than 5 seconds. Sure, you won’t instantly drop dead if you don’t have sex. It will be an even longer, more painful death. Statistics have PROVEN that sexless people die earlier. Contract more diseases and deal with more medical conditions. And of course: greater risk of suicide. It’s so fucking stupid that I actually need to explain this. If I said that cigarettes will kill you, you wouldn’t bat an eye. But if I say that lack of sex will kill you (in fact, it’s worse for you than cigarettes) then you freak. the fuck. out. Whatever dude, just admit that you were wrong about this scientific fact and I’ll stop embarrassing you. 

Site your sources my man, then we can get serious. What are these diseases? Is the correlation the causation when it comes to lack of sex? Abstinent people cant contract STDs so what else are they getting? Are these studies peer reviewed? What were the controlling factors and the lifestyle habits of the participants? I do believe that people could get depressed by lack of puss, god knows I would be, but a lot of other factors need to be taken into account as well. Also, where have you embarrassed me thus far?

&amp;#x200B;

&gt; Sticks and stones will break my bones, but nothing you can say will ever change the facts. 

A fact is defined as a thing that is known or proved to be true. Where have you proved any of the claims you have made?

&amp;#x200B;

&gt; I will not be shamed into silence. Cancel culture simply does not work on me, never will. Sorry for being curt, I’m just sick and tired of brain-dead vegetables like you trying to bullshit me. 

I would be salty too if someone I believed to be a ""brain-dead vegetable"" was getting more pussy than me. ;)",1615947351
16,MensRights,"There is a 1 hour delay fetching comments.

I will be messaging you in 7 days on [**2021-03-24 01:10:43 UTC**](http://www.wolframalpha.com/input/?i=2021-03-24%2001:10:43%20UTC%20To%20Local%20Time) to remind you of [**this link**](https://www.reddit.com/r/MensRights/comments/m6eo5d/female_manager_demanded_i_stop_sending_her_old/gr6tfed/?context=3)

[**CLICK THIS LINK**](https://www.reddit.com/message/compose/?to=RemindMeBot&amp;subject=Reminder&amp;message=%5Bhttps%3A%2F%2Fwww.reddit.com%2Fr%2FMensRights%2Fcomments%2Fm6eo5d%2Ffemale_manager_demanded_i_stop_sending_her_old%2Fgr6tfed%2F%5D%0A%0ARemindMe%21%202021-03-24%2001%3A10%3A43%20UTC) to send a PM to also be reminded and to reduce spam.

^(Parent commenter can ) [^(delete this message to hide from others.)](https://www.reddit.com/message/compose/?to=RemindMeBot&amp;subject=Delete%20Comment&amp;message=Delete%21%20m6eo5d)

*****

|[^(Info)](https://www.reddit.com/r/RemindMeBot/comments/e1bko7/remindmebot_info_v21/)|[^(Custom)](https://www.reddit.com/message/compose/?to=RemindMeBot&amp;subject=Reminder&amp;message=%5BLink%20or%20message%20inside%20square%20brackets%5D%0A%0ARemindMe%21%20Time%20period%20here)|[^(Your Reminders)](https://www.reddit.com/message/compose/?to=RemindMeBot&amp;subject=List%20Of%20Reminders&amp;message=MyReminders%21)|[^(Feedback)](https://www.reddit.com/message/compose/?to=Watchful1&amp;subject=RemindMeBot%20Feedback)|
|-|-|-|-|",1615947255
17,MensRights,"Population data gets you a more accurate summary of what is happening. That's where they ask a fixed audience a range of questions.

You find them that would and men are experiencing and perpetrating abuse in equal degrees.

Women are more likely to get hurt though. But there is also some info cited on this sub where women are much more likely to initiate abuse and not have it reciprocated.

A women's advocate would prefer to look at police reports and death rates. That's where they get to ignore the men.

One finer detail  is that while intimate partner murders are generally 1 to 3 men to women, murders in family violence are near equal at 40% men. 

That matters because that is what domestic violence services are meant to address. Family violence. Not intimate partner violence alone.",1615947229
18,MensRights,[deleted],1615947084
19,MensRights,"Yes, I think feminists are domestic terrorists.",1615947050
20,MensRights,"Please sign this petition for all men/boys whom live in this silent epidemic

\#wematter

[https://petition.parliament.uk/petitions/556250](https://petition.parliament.uk/petitions/556250)",1615947032
21,MensRights,"Correct. However I was focused on the cases where a Woman made the sole choice to carry a child, and then seek financial support and sole custody from a Male sex partner. I believe that Men should have a say. The current attitudes are completely unfair to Men.",1615946965
22,MensRights,Maybe you are right. What I find fishy is that there is no mention of the female accomplice who was also arrested. I wonder why?,1615946910
23,MensRights,"Its mostly light-hearted. It appeals to lots of different women.

- Lots of little girls have a witchy phase collecting rocks/bones/flowers, making potions, casting spells, making wishes.

- Women who are into, or loved as a child; tarot cards, astrology, crystal/essential oil ""spells"", home remedies, growing plants/herbs.

- Perceived as the original empowered/superhero girls club. 

- Plays into narratives of being an outsider to society (or the ""patriarchy"") i.e witch burning, the spinster/cat-lady aesthetic, the alternative/counterculture aesthetic, the hermit who lived in the forest and foraged instead of working ""for the man"".

- Provides an avenue where women can work on  internalised misogyny through ""reclaiming"" traditional/feminine hobbies like sewing or crystals in a counterculture/edgy framework.",1615946810
24,MensRights,Lol.,1615946690
25,MensRights,"I believe that it should A: be gender neutral (you already said this) and B: have a fixed amount. this is fixed amount should be roughly equal to what person 1 would have normally earned during that time, plus a bit more. this seems more fair than person 1 getting far more money than what they would have gotten.",1615946611
26,MensRights,"There are 200k men apart of this subreddit. Think about if 200k men tweeted "" menarenotmonsters"" or "" menarehuman"". We would go viral. But we not doing that",1615946553
27,MensRights,"How could you possibly believe i think this world is a paradise when we are both talking in a sub that talks about problems that we face.... Lmao, you disagreed with what you said basically.",1615946362
28,MensRights,Yes because if it is standard then men can't be blamed for getting a test. i think that this is extremely important,1615946225
29,MensRights,Are you a man or woman? Not that it matters too much but every post I see of yours here is always blaming a man. You basically never hold women accountable for their shorty actions or behaviors. Why be apart of a sub called men’s rights if you don’t believe we deserve any?,1615946128
30,MensRights,There is something deeper here.  A cover up.,1615945595
31,MensRights,"Don't make it hostile.  Just make it irrelevant.  Make her head of something completely unimportant.  Give her an office at the dark end of a rarely used hallway.  Cut her headcount, give her all new projects (and of course reassign anything she already has that's good), and just make her job as useless and menial as it can possibly be.

Just make sure everything is couched in super positive language.",1615945568
32,MensRights,Because there should be fairness for INDIVIDUALS who perpetrate crimes against other INDIVIDUALS. Is it such an unpalatable notion to treat perpetrators and victims as their own beings?,1615945249
33,MensRights,Good stuff!,1615945163
34,MensRights,"I got frisky one time and downloaded tinder, actually got a match and was hitting it off.

She started going on a tangent of hatred towards old white men. I didn’t even respond after that, just unfollowed them and deleted the app.",1615945149
35,MensRights,"Basically picked them up lunch time, had them over night, back to mother next day.",1615945056
36,MensRights,"Yep I agree and I've mentioned before about that particular double standard. If an ugly guy or just a guy a particular woman doesn't like asks them out on a date, sexual harassment. If a good looking guy they think is hot asks them out, he's getting laid tonight and no claims of sexual harassment.",1615944959
37,MensRights,Shit like that pisses me off. People want to be dads and get treated like shit :(,1615944928
38,MensRights,Australias court system is very broken and feminist loving. Works out better for them if broken due to more money.,1615944862
39,MensRights,How accurate would you say the movie Office Space is to that field?,1615944732
40,MensRights,[deleted],1615944730
41,MensRights,The 97% is fake news and you also have to take into account not all the 71% of women claiming sexual harrassment involved in the survey were being completely honest. I guarantee the criteria for what constitutes sexual harassment in the survey were so vague and unrealistic that half of those women weren't really sexually harassed at all. A guy asking you politely out or a date you aren't attracted to and reject is not sexual harassment but you will find many feminists out there claiming it is. That survey definitely had a feminist bias involved an therefore is immediately suspect.,1615944614
42,MensRights,"in most cases, it isn't a joke",1615944596
43,MensRights,Wikipedia is trash.,1615944569
44,MensRights,"if she wants to hire females that usually means WHITE and female  


My brown ass aint privileged here",1615944527
45,MensRights,"&gt; oppression Olympics

Nice buzz words, bro. You *almost* convinced me that society is a perfect utopia and nothing needs to change. Almost.",1615944524
46,MensRights,Thank you.,1615944512
47,MensRights,[deleted],1615944350
48,MensRights,"Okay, thank you for taking the time to respond 

&gt;you can still do things to make you more attractive. Get a haircut. Hit the gym. Ditch the old greasy hoodie that screams ""parents basement"" for some clothes that work with your figure.

HOLY SHIT. WHY DIDN’T I THINK OF THAT BEFORE?!? In fact, why didn’t the millions of incels in world realize this? Tell me, since you’re an expert on this topic, should I “take a shower” as well? 

&gt;Good high value men are the men that the majority of women will want to be with, as things like a stable job and a good outlook scream stability. 

My point is that men with high paying, stable jobs, tons of investment assets and no debt are still facing a WAY more difficult dating market than an even an average, plain, boring woman. I know because I am living proof. Woman have it easier when it comes to sex then men. That is undeniable. Now, should this change? Should we make things better for men? I say “Yes” but for some stupid fucking reason you say “No” because you’re afraid of looking like LE INKWELLL.

&gt;The more I read, the worse my picture of you gets. And I'm not trying to be mean, but your tone in this post is so hostile that I can't really picture you as anything but some bitter incel who hates women for not sleeping with him and hates better men for being more desirable hence making it harder for you to get your dick wet.

If you’re going to argue in bad faith, then it is literally a waste of my time to talk to you. And if you aren’t willing to believe the things I say about MY OWN LIFE, then you are wasting your own time talking to me. Going back and forth saying “You’re a misogynist!” “No I’m not!” “Yes you are!” Is going to get us nowhere. 

It’s truly beside the point. My personal identity has no affect on what is or is not true. I could be the worst child rapist on earth that lives in his moms basement, but if I said “2+2=4” I would be 100% correct. Say it with me: facts don’t care about your feelings. 

&gt;You haven't proposed any solution to your problems with women, you've just blah blah blah I’m a fucking retard 

Come on dude: Fix society, work on self improvement. If you want specifics that’s another discussion entirely but I’d be more than happy to give you a quick rundown. 

&gt;And if you want to be in the ""small minority of men"" who have access to thousands of times more sex than any human needs 

No. That’s like saying “Oh you don’t like being in prison? Why don’t you just start your own jail so you can be the one enslaving others instead of them enslaving you?” 

&gt;You say ""sex-starved"" like sex if equivalent to food and water. Pull your head out of your ass. 

That’s idiotic if you think about it for more than 5 seconds. Sure, you won’t instantly drop dead if you don’t have sex. It will be an even longer, more painful death. Statistics have PROVEN that sexless people die earlier. Contract more diseases and deal with more medical conditions. And of course: greater risk of suicide. It’s so fucking stupid that I actually need to explain this. If I said that cigarettes will kill you, you wouldn’t bat an eye. But if I say that lack of sex will kill you (in fact, it’s worse for you than cigarettes) then you freak. the fuck. out. Whatever dude, just admit that you were wrong about this scientific fact and I’ll stop embarrassing you. 

&gt;You can make yourself a better man if you so choose too, though I have little faith you will.

Sticks and stones will break my bones, but nothing you can say will ever change the facts. 

&gt;People like you give the rest of us in this movement a bad name/image

I will not be shamed into silence. Cancel culture simply does not work on me, never will. Sorry for being curt, I’m just sick and tired of brain-dead vegetables like you trying to bullshit me.",1615944315
49,MensRights,You are trash,1615944225
50,MensRights,If you are man voting for labour party in the uk you are a jew voting for german national socialist party.,1615944168
51,MensRights,"What is the deal with the ""witches"" thing in WitchesVsPatriarchy? Is there anything deeper to it, or is it just a fun little gimmick they added to the sub?",1615944156
52,MensRights,They'd be charged and at a minimum get probation and listed on the sex offenders registry for life.,1615944154
53,MensRights,In my experience old nerdy white guys are the smartest and have the most experience in IT.,1615944143
54,MensRights,"So, both sexist and ageist? Best avoid sending her any Jews as well. Bound to set her off. /s",1615944044
55,MensRights,No that’s why I said don’t use logic against feminists. They don’t understand it.,1615944037
56,MensRights,"You're right, feminists are just looking for ways to torture men, first alimony, then false rape, then literal abuse but plays victim. It horrible, men need to just disconnect from this society because it doesn't care about them",1615943999
57,MensRights,"Those 20 dodged a bullet. I can imagine the shit she'd pull on these guys she didn't want,but had to take. Dante didn't have a level for the poor bastard.",1615943934
58,MensRights,"For International Women's Day this year, HR sent out an email reminding everyone that for the same work, women only make 75 cents to the dollar.

It's not even reality, but they can't stop.",1615943896
59,MensRights,Ask if I can get a suit of armor also,1615943822
60,MensRights,"Yup it doesn't make any sense. S 114 of the WC explicitly laid out several factors and all of them are equally applicable for both spouses. The opponents are saying that the court will somehow lose its ability to make fair and objective rulings should spousal maintenance be made gender-neutral.

Maintenance is also not to only partial element in the Women's Charter. Part XI contains provisions that accord gender-specific protections only for female sex workers and females who are compelled to do sex work. Although male sex workers are very rare compared to female ones, gender-neutral protection does not take away anything from women, it just extends the same protection to everyone.",1615943821
61,MensRights,"r.feminism has a wide reputation for toxic mods. A lot of feminists complain that they aren't centrist enough, too extremist/radical (I.e removing top level comments and threads that advocate for sex worker aid/rights, which also got me a ban). It's hard to call out, as most feminist subreddits rule-out posts about other subs.

If you want to continue bridge-building, I can recommend r.askfeminists, r.witchesvsthepatriarchy (and definitely r.menslib).",1615943777
62,MensRights,Just do it in an above the books way.,1615943774
63,MensRights,"Men do more than ""advocate"" for women, especially those who are members of our families.",1615943697
64,MensRights,"And then the flood of lawsuits causes the company to lay off people. Whistle blowing is meant to go against institutions not lowly individuals. If the ceo or hr were doing this, by all means tell away. But this is an issue with an employee that isn't in a rule making position. So it really should be settled in house. Afterwards everyone that got rejected should be called back for another round of interviews.",1615943595
65,MensRights,"Wow this is a massive red pill it must be awful i hope you can do something in court maybe or the best is just to leave that enviroment overall get rid off her and restart fresh red pilled.  
You dont deserve to suffer.   
Your feelings, attention, emotions and mind are your private property for you to live own your own by your own under your own terms and definitions.  
Society is fucked up so we need to take measures to protect ourselves we dont deserve this, is unjustice, is unfar, is feminism aka female supremacy.

Shut dowm empathy for psycopaths and toxicity to keep yourself sane and strong and remake your life on a new eviroment thast what i would do i think, maybe travel to another state or country to work or something like that far away from the psycho.",1615943501
66,MensRights,Kutttchaww,1615943495
