,subreddit,body,created_utc
1417,MensRights,"You know, I've had some conversations with people from or originally from outside the US and Europe. Many of them say that actually following the same logic of feminists men are ""oppressed"" or at the very least have less rights (as weird as that my seem initially), and I am starting to agree with them to some extent. Not saying all men and women are the same, just in general. Keep in mind this is context/country dependant.

For example (briefly), women really have a higher degree of control in relationships and in families (even though they don't look it or act like it is not the case). They are entitled to their man's income but not the other way around. Generally speaking, for marriage the male has to have his shit together while the female has to just accept. Some women say ""I'm just as girl"" and get away with a lot of shit where males are expected to ""man up"". The list goes on, but I hope you got the point.",1616935168
1418,MensRights,Why would you feel weird upvoting it? Justice served.,1616935112
1419,MensRights,"I dont understand the hatred for incels..maybe I misunderstood but from what I gather an incel is someone who doesn't wanna deal with shit anymore, they have been rejected so many times and often times in disgusting ways that they are so hurt and tired they just don't care anymore....in movies if you saw that guy and fucked with him you would be the bad guy, people in the audience would say ""ugh what kinda dick character picking on the sad man"" but in real life you are cool to laugh at sad people? That seems fucked up to me.",1616934930
1420,MensRights,Stay strong. Never give up.,1616934666
1421,MensRights,And to think some women want to do away with prison for women all together,1616934612
1422,MensRights,"I wouldn't say feminism, most of the work is done by NGOs. Most people here don't even know that a word like 'feminism' even exists. The credit should go towards NGOs and not feminism.

Yes, I am glad that a lot of young girls in Pakistan are getting an education. Education is really important and a lot of people, especially from poor households still believe that men work and women shouldn't so educating them is pointless. But that needs to change.

But thankfully, more educated people know that education is important regardless of gender.",1616934541
1423,MensRights,Oh boo hoo the woman’s life was ruined because her boyfriend was on the sex offender registry. What about the guy? His life being ruined doesn’t matter? Gtfoh.,1616934382
1424,MensRights,"If the boy’s in middle school they won’t even call it making love, they will straight up say he took advantage of them. A 30 something year old woman getting taken advantage of by a middle school boy. Ain’t that a bitch?",1616934320
1425,MensRights,"While the carjacking was done porpoisely (lol), the flipping of the car was accidental.  That in no way justifies or excuses what they did.",1616934295
1426,MensRights,I'm literally doing my best. I appreciate your support. See my edit for details about therapy.,1616934294
1427,MensRights,Thank you so much! I need resources like this more than you know!,1616934245
1428,MensRights,"In the US, we could sue. Maybe our Aussie friends should collectively sue for child abuse? That is exactly what it is... child abuse.",1616934100
1429,MensRights,"Also, to add to that, this is true for most poor countries regardless of a person living in their own country or first world country.

Let me give you an example of freelancing because I have experience in that. Most freelancers from Pakistan (and other third world countries) would agree to work for you even for a fraction of a cost. It is because it's hard to get a job so people become freelancers instead and just to get work, they would agree to work with you regardless of cost. Also, even if $5 or $10 won't sound a lot for you you, it will be a lot for most of us. 

If you have ever used a freelance platform like Fiverr before, I'm sure you've noticed how low the prices are from people in third world country compared to others.",1616934093
1430,MensRights,"so what? that just goes to show how how bad society is to women for women to kill themselves so much.

&amp;#x200B;

owait men kill themselves 3-4 times more than women nvm",1616933956
1431,MensRights,"We're not at that point yet over here. But there are a few similar recent instances and all the stuff going in on the internet and in some places in he world regarding males just being inherently bad and a threat to women. The sad thing is, some men are jumping on the bandwagon.",1616933776
1432,MensRights,"Less than half of the females in Pakistan are literate whereas 71 percent of men are literate. Many sources suggest the overall illiteracy rates in Pakistan are increasing despite a global decrease overall. 

One of the ways feminism has made real change in societies is by vastly improving education for women. Do you feel this is an initiative that lacked foresight or are you supportive of improving access to education for young women in Pakistan that are clearly lagging behind their male peers?",1616933732
1433,MensRights,"Yes, I am aware of that. I think I heard something like this from someone from the USA too where big companies prefer hiring Mexicans because they will agree to work on really low wages. (I forgot what I read exactly but I think it was something similar to that.)

I think because of situations like these actual citizens don't get many job opportunities, even in low wage sectors.",1616933593
1434,MensRights,I think dads would find it amazing and every mother would benefit from it. I imagine giving birth and caring for a (your first) newborn child can be very exhausting. It would be great for both genders if dads had some (extra) time off to support their wives and children.,1616933589
1435,MensRights,"Do not go to the crossposted sub and vote or comment. Brigading and vote manipulation are against Reddit's rules.

*I am a bot, and this action was performed automatically. Please [contact the moderators of this subreddit](/message/compose/?to=/r/MensRights) if you have any questions or concerns.*",1616933558
1436,MensRights,"Do not go to the crossposted sub and vote or comment. Brigading and vote manipulation are against Reddit's rules.

*I am a bot, and this action was performed automatically. Please [contact the moderators of this subreddit](/message/compose/?to=/r/MensRights) if you have any questions or concerns.*",1616933448
1437,MensRights,"Oh so you are one of those who says that ""feminism is about equality"" lol
It's just not. You don't know why I am pissed over feminism. No it's not just because ""some"" feminists seems to want to overpower men, it's not that simple.

You are doing a strawman. Where did I said that the problem was solely on the fact that this account was only for women ? Because I didn't. In fact, it's not even a problem in itself, it's a symptom. If there's no TwitterMen account it's because Twitter as a company is just following trends, this account is just for PR. If they didn't made a TwitterMen account it's because they know they would receive a lot of backlash and they don't want to face it. Hence why people are angry at that. It's just showing how men are perceived in society, we can't have support.

Fighting ""for equality for women""? Don't you think it doesn't make any sense lmao. Equality is between 2 things at minimum, but you purposefully said ""equality for women"", why not ""equality between women and men""?
I know that there are aspects where men are more in power and vice versa and I absolutely agree, I'm an egalitarian, I thrive for equality for all humans, but you don't even ask yourself why I'm that mad over feminism (well you don't because you made up some reasons), why would feminism have the exclusivity of ""equality"" anyway ?
The thing that convinced me that feminism is absolutely not about equality is this scene in The Red Pill (https://youtu.be/48DQMoQ1QJ8l), I considered myself a feminist when I first saw this movie but to me it wasn't making sense that those people were protesting at some men talking about the issues they were facing and calling them names. There's even a woman saying that she would like to have both men and women talking about their issues yet she's protesting against them ???

So maybe you are being honest, you really think feminism is about equality and all, but it's really not. You can't be about equality when you shutdown any people who wants to speak about problems you don't get. You have to at least let them speak, understand what they are talking about and then get angry if there's something to be angry about, but just shutting down people before or when they speak just shows that you are afraid of what they might say.
If you are honest, if you really thrive for equality in society, please dig deeper into the subject, give more attention to problems men are facing, at least as much as women's, and you will reach the same conclusion as me : feminism ain't about equality, just be an egalitarian.

Btw the point your made about the tirade isn't pertinent, I was talking about the content (yk, the things I wrote between """")",1616933441
1438,MensRights,but thats 30-40% of U.S. population the other 30% is overweight 25-30 BMI,1616933440
1439,MensRights,Not a feminist. You would have known that if you possessed the ability to read.,1616933435
1440,MensRights,Which country? I live in the eu and I think I only have a few days.,1616933402
1441,MensRights,"Agreed, but more than 50% of the voters thought otherwise....",1616933323
1442,MensRights,Begin holding!,1616933255
1443,MensRights,"Ok, thank you very much for the info.

One more question, if you don't mind: Can you see/acknowledge the destabilizing effect that pakistani immigration has on the host countries?

Specifically competion in low wage sectors and resulting wage suppression for the poorer and more disadvantaged members of the host societies while benefiting the rich people in the host countries?",1616933246
1444,MensRights,"If it was a male principal doing this to girls, he would have 100% been fired",1616933128
1445,MensRights,"This belongs on r/cringe 

Low quality stuff makes men's rights look bad 😬",1616933077
1446,MensRights,Ya but medical metrics?  Obesity is just based on an increased risk of developing health issues.  Your feelings about it don't decrease your risk of developing health issues.,1616933074
1447,MensRights,"Tell that to mainstream media and the government. The so called “loudest” run modern society either directly through positions of power and influence or indirectly through dissemination of information through social media and the like. It’s more common for “feminists” to rally public support against a man than to help them. So, I’m sorry....but your statement is a pretty idealistic and unrealistic standpoint.",1616933047
1448,MensRights,"What is difference between sexual assault and rape, I never understood it",1616932981
1449,MensRights,"You're not wrong. Unfortunately, a lot of men (husbands/fathers) do that. But it's more common among people from villages and people with no (or some) education, even in cities or from poor families.

Yes, women are looked down upon if they are not covering themselves. But a lot of people don't beat them especially if they are not from your family. They usually get advice from their parents to do that. Also, most people who look down upon women who don't cover their bodies are other women.",1616932912
1450,MensRights,"could you elaborate?

I don't understand I would genuinely like to do so.

Thanks :-)",1616932723
1451,MensRights,Yeah and in a few more years they’ll do away with “over weight” like they did with “pre hypertension”,1616932698
1452,MensRights,"Moreover, a waist measurement of over 35 inches for women and 40 inches for men may also indicate obesity. 

https://www.singlecare.com/blog/news/obesity-statistics/",1616932601
1453,MensRights,"Yes, polygamous marriages are allowed but they are not as common. 4 husbands or wives are allowed per person. A man can marry all 4 at the same time but a woman can't marry another before divorcing the first.

The most common I've seen is a man having 2 wives but it's still not that common. Most people prefer monogamous marriages. The divorce rate is not very common among marriages but arranged marriages are more common.",1616932565
1454,MensRights,"&gt;Most women follow it not because of oppression or anything but because they respect their religion.
No offence but I really don't believe this to be the case. They follow it in fear of oppression from their husbands, their father, and just society's etc in general. Can you really tell me with utmost certainty that they wouldn't be heavily looked down upon and even beaten of they don't follow these things of their own will?",1616932471
1455,MensRights,"You’ll be called a misogynist or an incel if you do, sadly.",1616932417
1456,MensRights,Recently there was a school in Australia that did that. Had the boys apologize to the girls for being boys. There was a post about it on this sub if I'm remembering all this correctly. Its early and coffee hasn't kicked in yet... :P,1616932378
1457,MensRights,Because these wankers don’t want to listen to the truth.,1616932361
1458,MensRights,We live in a society that changes shit all the time because it hurts people’s feelings. Metrics change all the time because what was considered the average fluctuates.,1616932310
1459,MensRights,"Well no ones called on me to apologize on behalf of women yet, but I figure being a member of this sub and actively trying to support men and call out double standards is a start",1616932278
1460,MensRights,"Thanks for your swift and detailed reply.

May I ask how common polygamous marriages (one men, several wifes) are in Pakistan as per your experience/impression?

I'd suppose that this would further aggravate the situation of young men who not only have bad economic prospects (due to high birth rates) but also are further challenged to find a wife because more economicly successful men take several wifes and thus reduce the number of women available for marriage.",1616932190
1461,MensRights,If your BMI is higher than 30 you’re classified as obese,1616932161
1462,MensRights,Do you mean why is it bigoted when some people’s needs are marginalized because of their identity?,1616932143
1463,MensRights,"I found what I was looking for, so I'm deleting this post. Bye!",1616931832
1464,MensRights,"&gt; Your presentation seem to be taken the ‘Petition’ about wanting to ban men from driving, as if it’s serious

This isn't about my presentation. If you look at the posts of this screenshot in r/TrollXChromosomes and Feminism you will see that they are actually serious and are regarding roadside distractions as a true problem.  


&gt; asinine nature of the argument that girls showing shoulders at school is somehow sexual. 

There was no implication of this at any point in the above post, in fact it seemed to be mocking boys for lacking self restraint for supposedly being sidetracked by open shoulders.  
In any case, I do not care about the OP, it's more the feminist reaction I was interested in. So, if you will, I'm ending this right here.",1616931801
1465,MensRights,Hold,1616931746
1466,MensRights,you might reach her through [https://regardingmen.com/about/](https://regardingmen.com/about/),1616931740
1467,MensRights,"Do not go to the crossposted sub and vote or comment. Brigading and vote manipulation are against Reddit's rules.

*I am a bot, and this action was performed automatically. Please [contact the moderators of this subreddit](/message/compose/?to=/r/MensRights) if you have any questions or concerns.*",1616931535
1468,MensRights,"Through my goth phase I used to do the same, also when my wife wanted someone to practise on when she took up doing nails I was the volunteer, do whatever makes you and other happy.",1616931460
1469,MensRights,"Now dude you are just being stupid. Having Twitter making an official account and having someone else making an unofficial one isn't the same, period.
It's not that serious ? It actually is. It's just another symptom of how men are perceived in society, that's why people here are kinda angry about that. Simple as that.",1616931445
1470,MensRights,"&gt;I know this isn't really a men's rights issue

This is about as core a men's issue as it gets. That being said, this place is not exactly ideal for working on such sensitive issues. Due to the hands off moderation policy it can be a bit crude and combative at times and psychological expertise (which is what you need, I think) is pretty rare around here.

There's a community that might be of better help than this forum:

[https://regardingmen.com/about/](https://regardingmen.com/about/)

This was founded by two psychologists who are quite critical of the feminist bent that psychology has taken in the recent decades. Therefore they built this community for men to share their problems and be communal and helping each other.

Also, Tom Golden (who is a psychotherapist who specializes in men's issues and is a co-founder of the aforementioned community) has a website where you can contact him:

[https://menaregood.com/wordpress/](https://menaregood.com/wordpress/)

I think these spaces might be better suited at providing you with what you're looking for both in terms of psychological expertise to inform your support for your son as well as with respect to giving you a support group of guys and dads to discuss your issues.

I can't promise you anything, but I hope it helps.",1616931441
1471,MensRights,"Let me guess, you're very young? There's no way you can believe women don't have problems of their own. I suppose you also think racism isn't real or it affects white people worse?

Women are 91% of rape victims, and that's only the reported ones. They have to be far more wary than men while walking home at night because of this. They're also the majority of domestic abuse victims. Women are under more pressure to look nice, get laughed if they don't and get gawked at and potentially groped in the street if they do. Their natural physical inferiority to men leaves them far more vulnerable to violence. Women experience general sexism all the time, just look at in video game chats when someone hears a female voice, or when a YouTube comment has a woman in their profile picture. That's a problem ingrained in society.

Talking about suicides, homelessness and homicides are massive issues, but they only affect a small percentage of the male population. The majority of the things I listed affect almost all women.

Maybe it's best to realise that every group has issues, no matter how privileged you perceive them to be",1616931421
1472,MensRights,Oh yeah i forgot sorry mam !,1616931289
1473,MensRights,WOMEN AND CHILDREN FIRST!,1616931211
1474,MensRights,There's a YouTuber called Joel Haver who I've noticed paints his nails. It looks pretty cool actually.,1616931172
1475,MensRights,"Unlike in western countries, our culture is completely opposite and also extremely conservative. As it is a Muslim country, we have a lot of restrictions and strictly follow them.

Some of the examples are:

1. In western countries, it is believed that women should wear whatever they want. But in Muslim countries like mine, women are supposed to cover their bodies. Most women follow it not because of oppression or anything but because they respect their religion.
2. Same with sex. Sex before marriage is forbidden and most men and women will strictly follow it too. So it will be extremely rare to find pregnancy in women before marriage. So you wouldn't find anything promotions like birth control or stuff like that.

What I gathered from western countries about ""My body, my choice"" is that it is usually based on these two things. So promoting something like that here would be pointless.

Sure, this type of thinking might be good in western countries where premarital sex is common and all that stuff. But promoting something where they don't have this type of culture is pointless in my opinion.",1616931156
1476,MensRights,"Your presentation seem to be taken the ‘Petition’ about wanting to ban men from driving, as if it’s serious, and not a facetious remark about the asinine nature of the argument that girls showing shoulders at school is somehow sexual.",1616930944
1477,MensRights,Yeah right.  He was a toddler.  If it was a school aged boy she would have gotten away with it or just a slap on the wrist.  Don't kid yourself.,1616930909
1478,MensRights, SHIP IS SINKING SHIP IS SINKING !,1616930878
1479,MensRights,"I like being a beta male. Let the alphas do all the posing and posturing and hard work, while I earn my money at my 9-to-5, and then relax and enjoy my life.",1616930737
1480,MensRights,"Yes, you are right about this. Especially poor people here have a mindset that more kids equals more money. So they keep having kids. I'm from a middle-class family but even we have at least 3 kids/siblings per household. But even in middle-class families, people had a lot of kids during my parent's era. For example, my mom has 9 siblings and my dad has 4.

You're also right about the wages. Pakistan is one of the countries with the lowest wages. That's why most prefer going abroad to countries like the USA, Canada, Australia, etc. for better opportunities.

We don't have a concept of hourly wages, only monthly salary. But even people with Bachelors degrees can't earn enough. The starting salary of an engineer with a Bachelor's degree is somewhere between 30,000 to 40,000 rupees (\~$193 to $258 USD) per month. It increases of course based on experience.

Feel free to ask me anything you like. I will gladly answer you.",1616930630
1481,MensRights,What are you on about?,1616930560
1482,MensRights,Ah so this is where the brigading came from! Lol I figured as much.,1616930438
1483,MensRights,"Yeah, I'm not going to have an argument around libertarianism. We can agree to disagree, but I think paternity leave is one way to move the cultural needle around certain issues that people on this sub bemoan, like men not being taken as seriously as parents.",1616930341
1484,MensRights,AND that's also a part of the woman/man thing the Plea Deals.,1616930320
1485,MensRights,"&gt;These feminists were trying to promote the ""My body, my choice"" agenda here too.

Hmm? What's wrong with that?",1616930204
1486,MensRights,"It's true. She isn't very pretty and I'm someone who finds its really messed up that pretty women seem to not be subjected to actual justice. I know I'm a woman who is lurks here, and I do for a reason. My boyfriend has a son, he's nine now. Greatest little man you'd ever meet. I don't have any kids but he is amazing, I've known him for years now, greatest little man I've ever met. I'm one of his parents, he calls me one of his moms.

I never thought I could love someone else's son as much as I love this little man. I don't want to sound like trying to be tough person on internet, but I would have thoughts of murdering this woman if she ever did this to  Greyson.

And that's where it is even more messed up. This type of material is so rarely seen on reddit or other social media. Why is this type of thing so secluded to places like this sub and other unknown places of news? It bothers me even more that it is not only a possibility that he could have this happen to him (beyond terrible on its own) but it would be baried to the point you have to dig for it and even then, it's somehow a fucking debate, based on the dumb bitches looks or if the child wanted it, etc.

Fucking sick world we live in.",1616930138
1487,MensRights,"I assume this is the story you're referring to?

[https://edition.cnn.com/2021/03/27/us/washington-dc-uber-eats-carjacking-homicide/index.html](https://edition.cnn.com/2021/03/27/us/washington-dc-uber-eats-carjacking-homicide/index.html)",1616930129
1488,MensRights,"I think it's this one:

[https://edition.cnn.com/2021/03/27/us/washington-dc-uber-eats-carjacking-homicide/index.html](https://edition.cnn.com/2021/03/27/us/washington-dc-uber-eats-carjacking-homicide/index.html)",1616930090
1489,MensRights,"I think something similar happened. I can't confirm the source because I've only heard from multiple people here but I think some kind of NGO hired those women from another country. At least that's what I heard. I can agree with them because their Urdu (our native language) was not even that good.

They were trying to promote things that Pakistani women had for decades now. For example, rights to vote, owning property and cars, having high rankings in offices, etc. Women can literally do whatever men can do in Pakistan. If you spend even a few minutes googling that, you can find all these things.

Pakistan is mainly a Muslim country. The women who wear a burka (headscarf) don't do it because they are pressed, they do it because it's part of their religion. These feminists were trying to promote the ""My body, my choice"" agenda here too. It was hated by most women here, not just men. Women were even making fun of that statement lol.

That's why I think the women who were trying to promote feminism didn't do any research, regardless of where they were from.",1616929974
1490,MensRights,"Do not go to the crossposted sub and vote or comment. Brigading and vote manipulation are against Reddit's rules.

*I am a bot, and this action was performed automatically. Please [contact the moderators of this subreddit](/message/compose/?to=/r/MensRights) if you have any questions or concerns.*",1616929882
